symptoms,condition,domain
"The area where the adhesive bandage was is now red and bumpy.",allergic_dermatitis,general
"My skin is peeling and itchy after using a new body wash.",allergic_dermatitis,general
"I have a stinging, red rash on my arms from a new perfume.",allergic_dermatitis,general
"My skin is reacting with redness and small fluid-filled bumps.",allergic_dermatitis,general
"I'm seeing a lot of inflammation and itching on my wrists.",allergic_dermatitis,general
"The skin around my lips is red and scaly from a new lip balm.",allergic_dermatitis,general
"I have a very itchy, red patch of skin that feels very warm.",allergic_dermatitis,general
"I have thick, scaly patches of skin that itch uncontrollably.",eczema,general
"My skin is so dry it's cracking and bleeding on my knuckles.",eczema,general
"I have a red, weepy rash in the bends of my arms.",eczema,general
"The skin on my legs is very rough and has a silvery scale.",eczema,general
"I'm experiencing an intense flare-up of itchy skin on my neck.",eczema,general
"My hands are covered in dry, red patches that sting.",eczema,general
"I have chronic skin irritation that gets worse when I'm stressed.",eczema,general
"The skin behind my ears is flaky and very red.",eczema,general
"I'm getting small, itchy bumps on my fingers that clear fluid.",eczema,general
"My skin feels raw and tender after scratching the itchy spots.",eczema,general
"I have very sensitive skin that turns red and itchy easily.",eczema,general
"The rash on my ankles is very dark and the skin feels thick.",eczema,general
"I'm struggling with persistent dry skin that won't stay moisturized.",eczema,general
"My skin is peeling in patches and it's incredibly itchy.",eczema,general
"I have a red, inflamed rash on my chest that is very scaly.",eczema,general
"I have a red, itchy ring on my skin that is getting bigger.",fungal_skin_infection,general
"The skin between my toes is white, soggy, and very itchy.",fungal_skin_infection,general
"I have round, scaly patches on my arms that are very red.",fungal_skin_infection,general
"My groin is very itchy and has a red, raised border.",fungal_skin_infection,general
"I'm noticing white, splotchy patches on my back that don't tan.",fungal_skin_infection,general
"The skin under my armpits is red, raw, and smells musty.",fungal_skin_infection,general
"I have a fungal rash that looks like a cluster of small circles.",fungal_skin_infection,general
"My toenails are thick, yellowed, and crumbling at the edges.",fungal_skin_infection,general
"I have an itchy, red rash in the folds of my stomach.",fungal_skin_infection,general
"The skin on the bottom of my feet is scaling and very dry.",fungal_skin_infection,general
"I have a burning, itchy sensation in my groin area.",fungal_skin_infection,general
"My scalp has itchy, flaky patches and some hair loss.",fungal_skin_infection,general
"I'm seeing a red, spreading rash with a very clear edge.",fungal_skin_infection,general
"The skin between my fingers is red, itchy, and peeling.",fungal_skin_infection,general
"I have a persistent fungal infection that is making my skin raw.",fungal_skin_infection,general
"I feel very weak and my bones ache whenever I move.",vitamin_d_deficiency,general
"I'm losing a lot of hair and my mood has been very low lately.",vitamin_d_deficiency,general
"My muscles feel sore and heavy, like I have no strength.",vitamin_d_deficiency,general
"I'm getting sick with colds every few weeks and I'm tired.",vitamin_d_deficiency,general
"I have persistent lower back pain that won't go away.",vitamin_d_deficiency,general
"I feel very sluggish and I'm having trouble thinking clearly.",vitamin_d_deficiency,general
"My joints feel stiff and painful, especially in the morning.",vitamin_d_deficiency,general
"I'm experiencing a lot of fatigue despite resting all weekend.",vitamin_d_deficiency,general
"My bones feel tender to the touch, especially in my legs.",vitamin_d_deficiency,general
"I'm feeling very depressed and my body feels physically drained.",vitamin_d_deficiency,general
"I have a lot of muscle twitches and a general feeling of weakness.",vitamin_d_deficiency,general
"My wounds are very slow to heal and I feel constantly run down.",vitamin_d_deficiency,general
"I'm noticing that my teeth and jaw feel a bit achy lately.",vitamin_d_deficiency,general
"I have deep bone pain in my hips and I feel very exhausted.",vitamin_d_deficiency,general
"I'm struggling with low immunity and constant muscle aches.",vitamin_d_deficiency,general
"I have a sharp burning in my throat after I eat anything heavy.",acid_reflux,general
"I'm tasting bile in my mouth and my chest feels very tight.",acid_reflux,general
"I have a persistent dry cough that gets worse when I lie down.",acid_reflux,general
"My stomach acid feels like it's rising into my esophagus.",acid_reflux,general
"I'm experiencing painful heartburn right behind my breastbone.",acid_reflux,general
"I have a sour taste in my mouth and I'm burping constantly.",acid_reflux,general
"I feel like there is food stuck in my throat after I eat.",acid_reflux,general
"My voice is very hoarse and I have a constant sore throat.",acid_reflux,general
"I'm feeling nauseated and have a burning sensation in my upper belly.",acid_reflux,general
"I have chest pain that makes me think I'm having a heart problem.",acid_reflux,general
"I'm waking up at night choking on stomach acid.",acid_reflux,general
"I have a lot of indigestion and my chest feels very warm.",acid_reflux,general
"I'm burping up small amounts of food and acid regularly.",acid_reflux,general
"My throat feels irritated and I have a lot of gas in my stomach.",acid_reflux,general
"I have a burning feeling in my chest after drinking coffee.",acid_reflux,general
"My mouth is very dry and I'm feeling incredibly lightheaded.",dehydration,general
"I'm thirsty all the time and my urine is a dark amber color.",dehydration,general
"I have a pounding headache and I feel very weak and dizzy.",dehydration,general
"My skin doesn't go back down when I pinch it on my hand.",dehydration,general
"I'm not urinating as much as usual and I feel very sluggish.",dehydration,general
"I have a fast heart rate and my tongue feels very dry and sticky.",dehydration,general
"I'm feeling very confused and I have a dry, scratchy throat.",dehydration,general
"My eyes feel very dry and sunken and I have no energy.",dehydration,general
"I'm experiencing muscle cramps in my legs and extreme thirst.",dehydration,general
"I feel very hot but I'm not sweating even though I'm active.",dehydration,general
"My blood pressure is low and I feel faint when I stand up.",dehydration,general
"I have a persistent thirst that no amount of water seems to fix.",dehydration,general
"I'm feeling very irritable and have a dull, throbbing headache.",dehydration,general
"My urine output has dropped to almost nothing today.",dehydration,general
"I feel very drained and my mouth feels like it's full of cotton.",dehydration,general
"I'm so tired I can't even hold a conversation properly.",sleep_deprivation,general
"My head is fuzzy and I'm making a lot of mistakes at work.",sleep_deprivation,general
"I've been awake for over 24 hours and I feel very shaky.",sleep_deprivation,general
"My eyes are stinging and I have dark circles that won't go away.",sleep_deprivation,general
"I'm feeling very grumpy and everything is annoying me today.",sleep_deprivation,general
"I keep nodding off for a few seconds without realizing it.",sleep_deprivation,general
"My memory is shot and I can't remember what I did an hour ago.",sleep_deprivation,general
"I have a constant dull headache from not sleeping enough.",sleep_deprivation,general
"I'm feeling very uncoordinated and I keep tripping over things.",sleep_deprivation,general
"My brain feels like it's in a fog and I'm yawning constantly.",sleep_deprivation,general
"I'm craving junk food and I feel physically exhausted.",sleep_deprivation,general
"I've had very poor sleep for a week and I feel very low.",sleep_deprivation,general
"I'm struggling to stay awake while driving or sitting still.",sleep_deprivation,general
"My reaction time is very slow and I feel mentally drained.",sleep_deprivation,general
"I'm feeling very overwhelmed and my body feels very heavy.",sleep_deprivation,general
"My heart is thumping and I feel a tight knot in my chest.",anxiety,general
"I'm constantly worrying about things that might go wrong.",anxiety,general
"I feel very restless, like I need to keep moving all the time.",anxiety,general
"My hands are trembling and I'm sweating for no reason.",anxiety,general
"I have a persistent sense of impending doom and panic.",anxiety,general
"I'm breathing very shallowly and I feel like I can't get enough air.",anxiety,general
"My mind is racing with 'what if' scenarios all day long.",anxiety,general
"I feel very jumpy and my muscles are constantly tensed up.",anxiety,general
"I'm having trouble focusing because I'm so preoccupied with worry.",anxiety,general
"I have an upset stomach and a feeling of dread in my gut.",anxiety,general
"I'm feeling very on edge and I'm snapping at people.",anxiety,general
"I've been having panic attacks where my heart races and I sweat.",anxiety,general
"I'm avoiding certain places because they make me feel nervous.",anxiety,general
"I have cold, clammy hands and I'm feeling very uneasy.",anxiety,general
"I'm struggling to sleep because I'm worrying about the next day.",anxiety,general